{
  "$schema":"../../schemas/strategy_spec.schema.json",
  "schema_version":1,
  "strategy_id":"dca_baseline",
  "strategy_version":"1.4.0",
  "status":"implemented",
  "mode":"research_only",
  "purpose":"以60%长期资产、30%防御、10%科技卫星统一研究基准与个人目标；风险口径保持15%目标、约20%压力上限。",
  "inputs":{
    "timezone":"Asia/Shanghai","data_source":"validated_local_store_only","nav_field":"unit_nav",
    "contribution_cny":{"canonical":3000,"sensitivity":[4000,5000]},
    "schedule":{"budget_freeze_calendar_day":1,"limited_fund_start_calendar_day":1,"unlimited_fund_tranche_calendar_days":[5,15,25],"non_open_day_rule":"next_instrument_eligible_open_day"},
    "allocation":"20/20/10/10/30/10","allocation_role":"research_benchmark_and_personal_target","defensive_route":"006932"
  },
  "rules":{
    "signal":{"type":"precommitted_monthly_plan","depends_on_market_state":false,"depends_on_nav_or_return":false,"generated_once_per_calendar_month":true},
    "cash_flow":{"borrowing_or_leverage":false,"uninvested_amount":"remain_as_cash","carry_unfilled_order_across_month_end":true,"reserved_cash_counts_toward_its_sleeve":true},
    "buy_only_allocation":{"selling_allowed":false,"allocation_rule":"new cash fills current target gaps after invested value and reserved pending cash","overweight_sleeve_new_money":0},
    "instrument_routing":{"limited_route_rule":"start on first eligible date from month start and queue FIFO across month boundaries","unlimited_route_rule":"split monthly allocation across calendar days 5, 15, and 25","automatic_fund_substitution":false},
    "risk_boundary":{"policy_limits_are_external_vetoes":true,"target_maximum_drawdown_pct":15,"stress_limit_drawdown_pct":20,"stress_tolerance_is_approximate_not_a_return_target":true,"baseline_remains_valid_when_stress_requires_review":true}
  },
  "prohibitions":["use_same_day_unpublished_nav","forward_fill_missing_nav","borrow_cash","sell_to_restore_target_weights","average_independent_backtest_metrics_as_if_they_were_one_portfolio","replace_unavailable_fund_without_versioned_mapping_change","submit_real_orders"],
  "backtest_scenarios":{"contribution_cny":[3000,4000,5000],"uniform_purchase_fee_stress_rate":"0.0015","synthetic_stress_result_pct":-20.79977104615625},
  "required_outputs":["time_weighted_return","xirr","annualized_volatility","maximum_drawdown_and_recovery","cash_drag","data_rule_strategy_and_code_hashes"],
  "acceptance_tests":["same_inputs_produce_byte_equivalent_results","limited_fund_date_daily_cap_includes_prior_reservations","unlimited_fund_monthly_allocation_splits_into_three_executable_tranches","no_negative_cash_and_no_sell_events"],
  "known_blockers":["prospective_out_of_sample_observation_incomplete","exact_historical_channel_fee_and_limit_rules_incomplete","fund_specific_confirmation_and_qdii_calendar_rules_incomplete","strict_point_in_time_history_is_not_available_for_backfilled_nav"]
}
